{"limits":{"max_input_bytes":8192,"max_list_items":20,"max_output_bytes":8192,"max_steps":16,"max_text_bytes":80},"result":"result","spec_version":"omo.pure-data/v1","steps":[{"id":"words","op":"input.get","path":"/words"},{"id":"clean_words","input":"words","op":"text_list.normalize_ascii","reject_control_characters":true,"reject_empty":true,"trim_ascii_whitespace":true},{"comparison":"exact","enabled_from":{"default":true,"path":"/remove_duplicates"},"id":"organized_words","input":"clean_words","op":"text_list.unique"},{"id":"sorted_words","input":"organized_words","key":"ascii_case_insensitive","op":"text_list.sort_ascii","tie_break":"ascii_bytes"},{"id":"original_count","input":"words","op":"list.length"},{"id":"final_count","input":"sorted_words","op":"list.length"},{"fields":{"final_count":{"ref":"final_count"},"original_count":{"ref":"original_count"},"sorted_words":{"ref":"sorted_words"},"status":{"const":"completed"}},"id":"result","op":"result.object"}]}
