{"limits":{"max_input_bytes":8192,"max_list_items":20,"max_output_bytes":8192,"max_steps":16,"max_text_bytes":80},"result":"result","spec_version":"omo.pure-data/v1","steps":[{"id":"tags","op":"input.get","path":"/tags"},{"id":"clean","input":"tags","op":"text_list.normalize_ascii","reject_control_characters":true,"reject_empty":true,"trim_ascii_whitespace":true},{"id":"sorted","input":"clean","key":"ascii_case_insensitive","op":"text_list.sort_ascii","tie_break":"ascii_bytes"},{"fields":{"sorted_tags":{"ref":"sorted"},"status":{"const":"completed"}},"id":"result","op":"result.object"}]}
